{"artifact_bound":{"lower":0,"upper":80},"cert_sha256":"sha256:27c1089f28a4673d4b348344f82850b65b4d8ef220dae9277b210df3a4dc09c0","collateral_required":{"holder":0,"writer":80},"evidence":{"collateral_sufficiency":"proved","kernel_semantics":"proved","payoff_bound":"proved","settlement_replay":"implemented","unit_safety":"proved","witness_policy":"contract"},"imported_interfaces":[{"bound":{"lower":30,"upper":80},"contract":{"name":"hodl_contract","role":"import:hodl_value_v1.hodl_final"},"interface_object_id":"hodl_value_v1","interface_output":"hodl_final","name":"hodl_final","unit":"Amount[zUSD]"},{"bound":{"lower":10,"upper":60},"contract":{"name":"lpv_contract","role":"import:lp_value_v1.lpv_final"},"interface_object_id":"lp_value_v1","interface_output":"lpv_final","name":"lpv_final","unit":"Amount[zUSD]"}],"instance_policy":{"authorization_mode":"role_binding","maturity_required":false,"nonce_required":true,"required_party_roles":["holder","writer"],"settlement_window_required":false},"ir_hash":"sha256:bf1509a7c86dfd9cd2d353133de9abf879f2fdf2279c4bd3114636233e8e7be4","manifest_hash":"sha256:10bfe51a55b6821ca73855e541b79f1e11a2f916cd1e75a5fbea72f8903a911b","object_family":"capped_lp_loss_cover","object_name":"LPLossCover","object_version":"v1","parameters":[{"description":"Notional amount","maximum":1000,"minimum":0,"name":"n_notional","unit":"Scalar"},{"description":"Deductible amount","maximum":1000,"minimum":0,"name":"deductible","unit":"Amount[zUSD]"},{"description":"Payoff cap amount","maximum":1000,"minimum":0,"name":"cap_amount","unit":"Amount[zUSD]"},{"description":"Lower HODL value bound","maximum":1000,"minimum":0,"name":"hodl_lower","unit":"Amount[zUSD]"},{"description":"Upper HODL value bound","maximum":1000,"minimum":0,"name":"hodl_upper","unit":"Amount[zUSD]"},{"description":"Lower LP value bound","maximum":1000,"minimum":0,"name":"lpv_lower","unit":"Amount[zUSD]"},{"description":"Upper LP value bound","maximum":1000,"minimum":0,"name":"lpv_upper","unit":"Amount[zUSD]"}],"payoff_summary":"N * min(max(HODL_T - LPV_T - D, 0), Cap)","schema":"zenodex/fire-object-manifest/v1","settlement_asset":"zUSD","witnesses":[{"bound":{"lower":30,"upper":80},"contract":{"name":"hodl_contract","role":"witness:HODLValuePacket"},"freshness":"1 epoch","name":"HODLValuePacket"},{"bound":{"lower":10,"upper":60},"contract":{"name":"lpv_contract","role":"witness:LPValuePacket"},"freshness":"1 epoch","name":"LPValuePacket"}]}